{
  "slug": "corgispec-ask",
  "tier": "molecule",
  "version": "4.0.0-rc1",
  "description": "Answer vault questions with bounded retrieval and queue unverified knowledge for promotion",
  "depends_on": [
    "corgispec-memory-init"
  ],
  "platform": "universal",
  "tags": [
    "lifecycle",
    "memory",
    "qa",
    "retrieval"
  ],
  "installation": {
    "targets": [
      "opencode",
      "claude",
      "codex"
    ],
    "base_path": "molecules/corgispec-ask"
  }
}
