{
  "slug": "corgispec-qa-cli",
  "tier": "atom",
  "version": "1.0.0",
  "description": "CLI walkthrough — terminal-based verification of commands, flags, exit codes, pipes, and help output",
  "depends_on": [],
  "platform": "universal",
  "tags": ["qa", "cli", "walkthrough"],
  "installation": {
    "targets": ["opencode", "claude", "codex"],
    "base_path": "atoms/corgispec-qa-cli"
  }
}
