{
  "slug": "corgispec-review",
  "tier": "molecule",
  "version": "4.0.0-rc1",
  "description": "Explicit human whole-change decision after canonical Verify",
  "depends_on": [],
  "platform": "universal",
  "tags": [
    "lifecycle",
    "review"
  ],
  "installation": {
    "targets": [
      "opencode",
      "claude",
      "codex"
    ],
    "base_path": "molecules/corgispec-review"
  }
}
