{
  "slug": "corgispec-review-loop",
  "tier": "molecule",
  "version": "4.0.0-rc1",
  "description": "Collect structured Run Contract v3 Task Group review findings without writing lifecycle artifacts",
  "depends_on": [],
  "platform": "universal",
  "tags": [
    "loop",
    "review",
    "automation"
  ],
  "installation": {
    "targets": [
      "opencode",
      "claude",
      "codex"
    ],
    "base_path": "molecules/corgispec-review-loop"
  }
}
