{
  "slug": "corgispec-archive-change",
  "tier": "molecule",
  "version": "1.0.0",
  "description": "Close the change Issue, sync delta specs, and archive completed change (GitLab)",
  "depends_on": [
    "corgispec-memory-extract"
  ],
  "platform": "gitlab",
  "tags": [
    "lifecycle",
    "archive"
  ],
  "installation": {
    "targets": [
      "opencode",
      "claude",
      "codex"
    ],
    "base_path": "molecules/corgispec-archive-change"
  }
}
