{
  "slug": "openspec-memory-init",
  "tier": "atom",
  "version": "1.0.0",
  "description": "Initialize 3-layer memory structure (memory/ + wiki/) with templates and session protocol injection",
  "depends_on": [],
  "platform": "universal",
  "tags": [
    "lifecycle",
    "memory",
    "init"
  ],
  "installation": {
    "targets": [
      "opencode",
      "claude",
      "codex"
    ],
    "base_path": "openspec-memory-init"
  }
}
