{
  "slug": "corgispec-install",
  "tier": "molecule",
  "version": "4.0.0-rc1",
  "description": "Install or verify project assets with mandatory RFC-first Memory/Wiki",
  "depends_on": [
    "corgispec-memory-init"
  ],
  "platform": "universal",
  "tags": [
    "lifecycle",
    "install"
  ],
  "installation": {
    "targets": [
      "opencode",
      "claude",
      "codex"
    ],
    "base_path": "molecules/corgispec-install"
  }
}
