{
  "slug": "corgispec-lint",
  "tier": "molecule",
  "version": "4.0.0-rc1",
  "description": "Read-only validation of RFC-first Memory/Wiki health across 14 checks",
  "depends_on": [
    "corgispec-memory-init"
  ],
  "platform": "universal",
  "tags": [
    "lifecycle",
    "memory",
    "lint",
    "health"
  ],
  "installation": {
    "targets": [
      "opencode",
      "claude",
      "codex"
    ],
    "base_path": "molecules/corgispec-lint"
  }
}
