{
  "slug": "corgispec-gh-apply",
  "tier": "molecule",
  "version": "1.0.0",
  "description": "Execute one Task Group checkpoint with closeout and issue sync (GitHub)",
  "depends_on": [],
  "platform": "github",
  "tags": [
    "lifecycle",
    "apply"
  ],
  "installation": {
    "targets": [
      "opencode",
      "claude",
      "codex"
    ],
    "base_path": "molecules/corgispec-gh-apply"
  }
}
