{
  "slug": "corgispec-review-loop",
  "tier": "molecule",
  "version": "1.0.0",
  "description": "Evidence-only review for loop mode — 5-axis quality checks, writes review.json, no human gate, no issue posting",
  "depends_on": [],
  "platform": "universal",
  "tags": [
    "loop",
    "review",
    "automation"
  ],
  "installation": {
    "targets": [
      "opencode",
      "claude",
      "codex"
    ],
    "base_path": "molecules/corgispec-review-loop"
  }
}
