{
  "slug": "corgispec-loop",
  "tier": "compound",
  "version": "2.0.0",
  "platform": "universal",
  "description": "Run Contract v2 executor that performs work while delegating all canonical state and evidence mutations to the corgispec loop CLI.",
  "depends_on": [
    "corgispec-apply-change",
    "corgispec-verify",
    "corgispec-review-loop"
  ],
  "installation": {
    "targets": ["opencode", "claude", "codex"],
    "base_path": "compounds/corgispec-loop"
  }
}
