{
  "slug": "corgispec-verify",
  "tier": "molecule",
  "version": "1.0.0",
  "description": "Standalone verification gate for apply checkpoints \u2014 runs tests, checks spec coverage, validates lint/build",
  "depends_on": [],
  "platform": "universal",
  "tags": [
    "lifecycle",
    "verify"
  ],
  "installation": {
    "targets": [
      "opencode",
      "claude",
      "codex"
    ],
    "base_path": "molecules/corgispec-verify"
  }
}
