{
  "slug": "corgispec-propose",
  "tier": "molecule",
  "version": "1.0.0",
  "description": "Generate planning artifacts and create one tracked GitLab Issue",
  "depends_on": [],
  "platform": "gitlab",
  "tags": [
    "lifecycle",
    "propose"
  ],
  "installation": {
    "targets": [
      "opencode",
      "claude",
      "codex"
    ],
    "base_path": "molecules/corgispec-propose"
  }
}
